{
  "$schema": "https://json-schema.org/draft/2020-12/schema",
  "$id": "https://gomoku.games/gomoku-json-schema.json",
  "title": "Gomoku Game State JSON Schema",
  "description": "JSON schema for Gomoku game state, used for saving games and client-server communication with gomoku-httpd",
  "type": "object",
  "required": ["X", "O", "moves"],
  "properties": {
    "X": {
      "$ref": "#/$defs/player",
      "description": "Configuration and stats for the X player (always moves first)"
    },
    "O": {
      "$ref": "#/$defs/player",
      "description": "Configuration and stats for the O player"
    },
    "board_size": {
      "type": "integer",
      "enum": [15, 19],
      "default": 19,
      "description": "Size of the game board (15x15 or 19x19). Defaults to 19 if not specified."
    },
    "radius": {
      "type": "integer",
      "minimum": 1,
      "maximum": 10,
      "description": "Search radius around existing stones for AI move generation"
    },
    "timeout": {
      "oneOf": [
        { "type": "string", "const": "none" },
        { "type": "integer", "minimum": 0 }
      ],
      "description": "Move timeout: 'none' for unlimited, or seconds as integer"
    },
    "undo": {
      "type": "boolean",
      "description": "Whether undo is enabled. Default true when omitted."
    },
    "undo_limit": {
      "type": "integer",
      "minimum": 0,
      "description": "Total undo moves allowed per game when undo is enabled; 0 means unlimited. Default 5 when omitted."
    },
    "winner": {
      "type": "string",
      "enum": ["none", "X", "O", "draw"],
      "description": "Winner of the game: 'X', 'O', 'draw', or 'none' if still in progress"
    },
    "board_state": {
      "type": "array",
      "description": "Visual representation of the board as an array of strings. Each string represents a row with cells separated by spaces. Cells contain '.', 'X', 'O', or Unicode equivalents",
      "items": {
        "type": "string",
        "pattern": "^[.XO✕○ ]+$"
      }
    },
    "moves": {
      "type": "array",
      "description": "Chronological list of moves made in the game",
      "items": {
        "$ref": "#/$defs/move"
      }
    },
    "name": {
      "type": "string",
      "description": "Name identifier for tactical test scenarios"
    },
    "description": {
      "type": "string",
      "description": "Human-readable description of the game or test scenario"
    },
    "category": {
      "type": "string",
      "enum": ["offense", "defense"],
      "description": "Category for tactical test scenarios"
    },
    "difficulty": {
      "type": "string",
      "enum": ["trivial", "easy", "medium", "hard"],
      "description": "Difficulty level for tactical test scenarios"
    },
    "expected_moves": {
      "type": "array",
      "description": "List of acceptable correct moves for tactical tests",
      "items": {
        "$ref": "#/$defs/coordinate"
      }
    },
    "explanation": {
      "type": "string",
      "description": "Explanation of the expected move for tactical tests"
    }
  },
  "$defs": {
    "player": {
      "type": "object",
      "required": ["player"],
      "properties": {
        "player": {
          "type": "string",
          "enum": ["human", "AI"],
          "description": "Type of player controlling this side"
        },
        "depth": {
          "type": "integer",
          "minimum": 1,
          "maximum": 20,
          "description": "Search depth for AI players (required if player is 'AI')"
        },
        "time_ms": {
          "type": "number",
          "minimum": 0,
          "description": "Total time spent by this player in milliseconds"
        }
      },
      "if": {
        "properties": { "player": { "const": "AI" } }
      },
      "then": {
        "required": ["depth"]
      }
    },
    "coordinate": {
      "oneOf": [
        {
          "type": "string",
          "pattern": "^[A-HJ-T][0-9]{1,2}$",
          "description": "Board coordinate in compact notation (column letter, row digits), e.g. H7"
        },
        {
          "type": "array",
          "description": "Legacy coordinate as [row, column], 0-indexed from top-left",
          "items": {
            "type": "integer",
            "minimum": 0
          },
          "minItems": 2,
          "maxItems": 2
        }
      ]
    },
    "notation": {
      "type": "string",
      "pattern": "^[A-HJ-T]([1-9]|1[0-9])$",
      "description": "Human-readable move coordinate: column letter (A–T excluding I) plus 1-based row (1–19). Examples: A1, J10, T19. Converts to/from coordinate [row, col] via board_coord_to_notation / notation_to_board_coord."
    },
    "position": {
      "oneOf": [
        { "$ref": "#/$defs/coordinate" },
        { "$ref": "#/$defs/notation" }
      ],
      "description": "Move position: either [row, col] 0-indexed array or notation string (e.g. \"A2\", \"J10\")."
    },
    "scoring_entry": {
      "type": "object",
      "description": "Result from a single evaluator step during AI move selection",
      "required": ["player", "evaluator", "evaluated_moves", "score", "time_ms"],
      "properties": {
        "player": {
          "type": "string",
          "enum": ["current", "opponent"],
          "description": "Whose perspective this evaluator checked: 'current' (AI to move) or 'opponent'"
        },
        "evaluator": {
          "type": "string",
          "enum": ["have_win", "block_threat", "compound_three", "have_vct", "block_vct", "block_open_three", "forcing_four", "minimax"],
          "description": "Name of the evaluator step"
        },
        "evaluated_moves": {
          "type": "integer",
          "minimum": 0,
          "description": "Number of candidate moves this evaluator examined"
        },
        "score": {
          "type": "integer",
          "description": "Best score found by this evaluator. Positive for current player advantage, negative for opponent threats"
        },
        "time_ms": {
          "type": "number",
          "minimum": 0,
          "description": "Wall-clock time spent in this evaluator step (milliseconds)"
        },
        "decisive": {
          "type": "boolean",
          "description": "True if this evaluator determined the final move choice"
        },
        "have_win": {
          "type": "boolean",
          "description": "True if an immediate winning move was found"
        },
        "have_vct": {
          "type": "boolean",
          "description": "True if a Victory by Continuous Threats sequence was found"
        },
        "vct_sequence": {
          "type": "array",
          "description": "Sequence of forcing moves in the VCT (only present when have_vct is true)",
          "items": {
            "$ref": "#/$defs/coordinate"
          }
        }
      },
      "additionalProperties": false
    },
    "move": {
      "type": "object",
      "description": "A single move in the game. Contains exactly one move key (X (human), X (AI), O (human), O (AI)) whose value is the move position: either [row, col] 0-indexed or notation string (e.g. \"A2\").",
      "minProperties": 1,
      "properties": {
        "X (human)": {
          "$ref": "#/$defs/position",
          "description": "Move position for human X: [row, col] or notation (e.g. \"J10\")"
        },
        "X (AI)": {
          "$ref": "#/$defs/position",
          "description": "Move position for AI X: [row, col] or notation"
        },
        "O (human)": {
          "$ref": "#/$defs/position",
          "description": "Move position for human O: [row, col] or notation"
        },
        "O (AI)": {
          "$ref": "#/$defs/position",
          "description": "Move position for AI O: [row, col] or notation"
        },
        "notation": {
          "type": "string",
          "description": "Human-readable position (e.g. \"A2\", \"J10\"). Serialized by server when returning game state; column A–T excluding I, row 1-based."
        },
        "time_ms": {
          "type": "number",
          "minimum": 0,
          "description": "Time taken for this move in milliseconds"
        },
        "moves_evaluated": {
          "type": "integer",
          "minimum": 0,
          "description": "Number of positions evaluated by AI for this move"
        },
        "moves_searched": {
          "type": "integer",
          "minimum": 0,
          "description": "Deprecated: use moves_evaluated. Kept for backwards compatibility"
        },
        "score": {
          "type": "integer",
          "description": "Threat score created by this move for the moving player"
        },
        "opponent": {
          "type": "integer",
          "description": "Threat score the opponent would have gained by playing here"
        },
        "winner": {
          "type": "boolean",
          "description": "True if this move wins the game"
        },
        "queue_wait_ms": {
          "type": "number",
          "minimum": 0,
          "description": "Time spent waiting in the server queue before processing (milliseconds). Passed through from client request."
        },
        "offensive_max_score": {
          "type": "integer",
          "description": "Best offensive score found across all evaluators (only on last AI move, when --report-scoring is enabled)"
        },
        "defensive_max_score": {
          "type": "integer",
          "description": "Best opponent threat score found (negative value; only on last AI move, when --report-scoring is enabled)"
        },
        "think_time_ms": {
          "type": "number",
          "minimum": 0,
          "description": "Total AI thinking time for this move in milliseconds (only on last AI move, when --report-scoring is enabled)"
        },
        "scoring": {
          "type": "array",
          "description": "Detailed scoring report showing each evaluator step the AI ran to decide this move (only on last AI move, when --report-scoring is enabled)",
          "items": {
            "$ref": "#/$defs/scoring_entry"
          }
        }
      },
      "additionalProperties": false
    }
  }
}
