{
  "name": "win_in_one",
  "description": "X can win immediately by completing five in a row",
  "category": "offense",
  "difficulty": "trivial",
  "board_size": 15,
  "X": {"player": "AI", "depth": 4},
  "O": {"player": "human"},
  "moves": [
    {"X (AI)": "H7"},
    {"O (human)": "J8"},
    {"X (AI)": "J7"},
    {"O (human)": "K8"},
    {"X (AI)": "K7"},
    {"O (human)": "L8"},
    {"X (AI)": "L7"},
    {"O (human)": "K9"}
  ],
  "expected_moves": [[7, 6], [7, 11]],
  "explanation": "X has four in a row and can win by playing [7,6] or [7,11]"
}
