{
  "X":{
    "player":"AI",
    "depth":5,
    "time_ms":15677.211
  },
  "O":{
    "player":"AI",
    "depth":5,
    "time_ms":5142.720
  },
  "board_size":15,
  "radius":2,
  "timeout":"none",
  "undo":true,
  "undo_limit":5,
  "winner":"X",
  "board_state":[
    ". . . . . . . . . . . . . . .",
    ". . . . . . . . . . . . . . .",
    ". . . . . . . . . . . . . . .",
    ". . . . . . . . . . . . . . .",
    ". . . . . . . . . . . . . . .",
    ". . . . . . O . . X . . . . .",
    ". . . O . O X O O X . . . . .",
    ". . . . X O X X X X O . . . .",
    ". . . . . X X O O X O . . . .",
    ". . . . X O X X O X . . . . .",
    ". . . X . . O X X O . . . . .",
    ". . O . . . . X O O . . . . .",
    ". . . . . . . O . . . . . . .",
    ". . . . . . . . . . . . . . .",
    ". . . . . . . . . . . . . . ."
  ],
  "moves":[
    {
      "X (AI)":"H7",
      "moves_evaluated":10,
      "time_ms":0.000
    },
    {
      "O (AI)":"J8",
      "moves_evaluated":85,
      "opponent":100,
      "time_ms":0.000
    },
    {
      "X (AI)":"G8",
      "moves_evaluated":160,
      "score":100,
      "time_ms":533.263
    },
    {
      "O (AI)":"J6",
      "moves_evaluated":2,
      "opponent":1500,
      "time_ms":0.022
    },
    {
      "X (AI)":"H9",
      "moves_evaluated":210,
      "score":100,
      "opponent":100,
      "time_ms":1020.508
    },
    {
      "O (AI)":"F7",
      "moves_evaluated":3,
      "opponent":1500,
      "time_ms":0.028
    },
    {
      "X (AI)":"G9",
      "moves_evaluated":255,
      "score":2000,
      "time_ms":1530.971
    },
    {
      "O (AI)":"J9",
      "moves_evaluated":51,
      "score":100,
      "opponent":1500,
      "time_ms":0.419
    },
    {
      "X (AI)":"J7",
      "moves_evaluated":1,
      "score":100,
      "opponent":500000,
      "time_ms":0.013
    },
    {
      "O (AI)":"H8",
      "moves_evaluated":1,
      "score":100,
      "opponent":40000,
      "time_ms":0.012
    },
    {
      "X (AI)":"G7",
      "moves_evaluated":1,
      "score":30000,
      "opponent":1500,
      "time_ms":0.020
    },
    {
      "O (AI)":"G10",
      "moves_evaluated":3,
      "opponent":500000,
      "time_ms":0.011
    },
    {
      "X (AI)":"G6",
      "moves_evaluated":1,
      "score":100000,
      "opponent":100,
      "time_ms":0.017
    },
    {
      "O (AI)":"G5",
      "moves_evaluated":2,
      "opponent":1000000,
      "time_ms":0.013
    },
    {
      "X (AI)":"K7",
      "moves_evaluated":1,
      "score":100000,
      "opponent":100,
      "time_ms":0.020
    },
    {
      "O (AI)":"L7",
      "moves_evaluated":1,
      "opponent":1000000,
      "time_ms":0.014
    },
    {
      "X (AI)":"K8",
      "moves_evaluated":65,
      "score":2000,
      "opponent":30000,
      "time_ms":0.607
    },
    {
      "O (AI)":"F6",
      "moves_evaluated":325,
      "score":2000,
      "opponent":100,
      "time_ms":5142.021
    },
    {
      "X (AI)":"E9",
      "moves_evaluated":325,
      "time_ms":4204.592
    },
    {
      "O (AI)":"F9",
      "moves_evaluated":1,
      "score":100,
      "opponent":100000,
      "time_ms":0.017
    },
    {
      "X (AI)":"F8",
      "moves_evaluated":1,
      "score":3000,
      "opponent":500000,
      "time_ms":0.018
    },
    {
      "O (AI)":"H6",
      "moves_evaluated":2,
      "opponent":500000,
      "time_ms":0.016
    },
    {
      "X (AI)":"D10",
      "moves_evaluated":1,
      "score":100000,
      "time_ms":0.024
    },
    {
      "O (AI)":"C11",
      "moves_evaluated":1,
      "opponent":1000000,
      "time_ms":0.014
    },
    {
      "X (AI)":"E7",
      "moves_evaluated":410,
      "score":1500,
      "opponent":1500,
      "time_ms":8387.009
    },
    {
      "O (AI)":"D6",
      "moves_evaluated":2,
      "opponent":500000,
      "time_ms":0.020
    },
    {
      "X (AI)":"H10",
      "moves_evaluated":1,
      "score":100000,
      "opponent":100,
      "time_ms":0.031
    },
    {
      "O (AI)":"J11",
      "moves_evaluated":1,
      "opponent":1000000,
      "time_ms":0.021
    },
    {
      "X (AI)":"J10",
      "moves_evaluated":1,
      "score":500,
      "opponent":100000,
      "time_ms":0.022
    },
    {
      "O (AI)":"K11",
      "moves_evaluated":1,
      "score":100,
      "opponent":100000,
      "time_ms":0.022
    },
    {
      "X (AI)":"H11",
      "moves_evaluated":1,
      "score":500,
      "opponent":40000,
      "time_ms":0.023
    },
    {
      "O (AI)":"H12",
      "moves_evaluated":2,
      "score":100,
      "opponent":100000,
      "time_ms":0.023
    },
    {
      "X (AI)":"K9",
      "moves_evaluated":1,
      "score":40000,
      "time_ms":0.035
    },
    {
      "O (AI)":"L8",
      "moves_evaluated":4,
      "score":100,
      "opponent":500000,
      "time_ms":0.024
    },
    {
      "X (AI)":"K6",
      "moves_evaluated":1,
      "score":500000,
      "opponent":500,
      "time_ms":0.019
    },
    {
      "O (AI)":"K10",
      "moves_evaluated":3,
      "score":30000,
      "opponent":1000000,
      "time_ms":0.023
    },
    {
      "X (AI)":"K5",
      "moves_evaluated":1,
      "score":1000000,
      "time_ms":0.019,
      "winner":true
    }
  ]
}