{
  "X": { "player": "human", "time_ms": 4500.000 },
  "O": { "player": "AI", "depth": 4, "time_ms": 2000.000 },
  "board_size": 19,
  "radius": 2,
  "timeout": "none",
  "winner": "X",
  "board_state": [
    ". . . . . . . . . . . . . . . . . . .",
    ". . . . . . . . . . . . . . . . . . .",
    ". . . . . . . . . . . . . . . . . . .",
    ". . . . . . . . . . . . . . . . . . .",
    ". . . . . . . . . . . . . . . . . . .",
    ". . . . . . . . . . . . . . . . . . .",
    ". . . . . . . . . . . . . . . . . . .",
    ". . . . . . . . O . . . . . . . . . .",
    ". . . . . . . . X O . . . . . . . . .",
    ". . . . . . . . X X O . . . . . . . .",
    ". . . . . . . . X . O . . . . . . . .",
    ". . . . . . . . X . . . . . . . . . .",
    ". . . . . . . . X . . . . . . . . . .",
    ". . . . . . . . . . . . . . . . . . .",
    ". . . . . . . . . . . . . . . . . . .",
    ". . . . . . . . . . . . . . . . . . .",
    ". . . . . . . . . . . . . . . . . . .",
    ". . . . . . . . . . . . . . . . . . .",
    ". . . . . . . . . . . . . . . . . . ."
  ],
  "moves": [
    { "X (human)": "K9", "time_ms": 500.000 },
    { "O (AI)": "K8", "time_ms": 200.000, "moves_searched": 150 },
    { "X (human)": "J8", "time_ms": 500.000 },
    { "O (AI)": "L9", "time_ms": 200.000, "moves_searched": 180 },
    { "X (human)": "J9", "time_ms": 500.000 },
    { "O (AI)": "L10", "time_ms": 200.000, "moves_searched": 200 },
    { "X (human)": "J10", "time_ms": 500.000 },
    { "O (AI)": "J7", "time_ms": 200.000, "moves_searched": 220 },
    { "X (human)": "J11", "time_ms": 500.000 },
    { "O (AI)": "K10", "time_ms": 200.000, "moves_searched": 250 },
    { "X (human)": "J12", "time_ms": 500.000, "winner": true }
  ]
}
