{
  "X":{
    "player":"AI",
    "depth":4,
    "time_ms":5203.020
  },
  "O":{
    "player":"AI",
    "depth":4,
    "time_ms":931.675
  },
  "board_size":15,
  "radius":3,
  "timeout":"none",
  "undo":true,
  "winner":"X",
  "board_state":[
    ". . . . . . . . . . . . . . .",
    ". . . . . . . . . . . . . . .",
    ". . . . . . . . . . . . . . .",
    ". . . . . . . . . . . . . . .",
    ". . . . . ○ . . . . . . . . .",
    ". . . . . . ✕ . ○ . . . . . .",
    ". . . . . ○ ○ ✕ ○ . . . . . .",
    ". . . . ○ ✕ ✕ ✕ ✕ ○ . . . . .",
    ". . . ○ . ✕ ✕ ○ ○ ✕ . . . . .",
    ". . . ○ ✕ ✕ ✕ . . . ○ . . . .",
    ". . . ○ ✕ ✕ ✕ . . . . . . . .",
    ". . . ○ . ○ ✕ . . . . . . . .",
    ". . . . . . . . . . . . . . .",
    ". . . . . . . . . . . . . . .",
    ". . . . . . . . . . . . . . ."
  ],
  "moves":[
    {
      "X (AI)":"H7",
      "moves_evaluated":1,
      "time_ms":0.014
    },
    {
      "O (AI)":"J8",
      "moves_evaluated":1,
      "opponent":100,
      "time_ms":0.000
    },
    {
      "X (AI)":"H6",
      "moves_evaluated":240,
      "score":100,
      "time_ms":365.496
    },
    {
      "O (AI)":"H8",
      "moves_evaluated":2,
      "score":100,
      "opponent":1500,
      "time_ms":0.029
    },
    {
      "X (AI)":"G8",
      "moves_evaluated":264,
      "score":100,
      "opponent":1500,
      "time_ms":420.465
    },
    {
      "O (AI)":"J6",
      "moves_evaluated":288,
      "opponent":3000,
      "time_ms":411.459
    },
    {
      "X (AI)":"J7",
      "moves_evaluated":292,
      "score":2000,
      "opponent":3000,
      "time_ms":465.762
    },
    {
      "O (AI)":"K7",
      "moves_evaluated":288,
      "score":2000,
      "opponent":1500,
      "time_ms":520.001
    },
    {
      "X (AI)":"K8",
      "moves_evaluated":312,
      "score":1500,
      "opponent":500,
      "time_ms":802.650
    },
    {
      "O (AI)":"L9",
      "moves_evaluated":2,
      "opponent":500000,
      "time_ms":0.013
    },
    {
      "X (AI)":"G5",
      "moves_evaluated":1,
      "score":100000,
      "time_ms":0.010
    },
    {
      "O (AI)":"F4",
      "moves_evaluated":1,
      "opponent":1000000,
      "time_ms":0.015
    },
    {
      "X (AI)":"G7",
      "moves_evaluated":440,
      "score":2000,
      "opponent":100,
      "time_ms":1363.824
    },
    {
      "O (AI)":"G6",
      "moves_evaluated":2,
      "opponent":500000,
      "time_ms":0.016
    },
    {
      "X (AI)":"F7",
      "moves_evaluated":1,
      "score":100000,
      "opponent":100,
      "time_ms":0.011
    },
    {
      "O (AI)":"E7",
      "moves_evaluated":1,
      "opponent":1000000,
      "time_ms":0.014
    },
    {
      "X (AI)":"F8",
      "moves_evaluated":464,
      "score":3000,
      "opponent":100,
      "time_ms":1784.676
    },
    {
      "O (AI)":"J5",
      "moves_evaluated":2,
      "opponent":500000,
      "time_ms":0.020
    },
    {
      "X (AI)":"E9",
      "moves_evaluated":1,
      "score":100000,
      "time_ms":0.012
    },
    {
      "O (AI)":"D10",
      "moves_evaluated":1,
      "opponent":1000000,
      "time_ms":0.017
    },
    {
      "X (AI)":"F9",
      "moves_evaluated":1,
      "score":30000,
      "time_ms":0.021
    },
    {
      "O (AI)":"F6",
      "moves_evaluated":3,
      "opponent":500000,
      "time_ms":0.018
    },
    {
      "X (AI)":"F10",
      "moves_evaluated":2,
      "score":100000,
      "time_ms":0.014
    },
    {
      "O (AI)":"F11",
      "moves_evaluated":2,
      "opponent":1000000,
      "time_ms":0.017
    },
    {
      "X (AI)":"E10",
      "moves_evaluated":1,
      "score":100000,
      "opponent":100,
      "time_ms":0.013
    },
    {
      "O (AI)":"D11",
      "moves_evaluated":1,
      "score":100,
      "opponent":1000000,
      "time_ms":0.018
    },
    {
      "X (AI)":"G9",
      "moves_evaluated":1,
      "score":30000,
      "time_ms":0.023
    },
    {
      "O (AI)":"D9",
      "moves_evaluated":3,
      "score":1500,
      "opponent":500000,
      "time_ms":0.021
    },
    {
      "X (AI)":"G10",
      "moves_evaluated":2,
      "score":100000,
      "opponent":100,
      "time_ms":0.014
    },
    {
      "O (AI)":"D8",
      "moves_evaluated":2,
      "score":500000,
      "opponent":1500,
      "time_ms":0.017
    },
    {
      "X (AI)":"G11",
      "moves_evaluated":3,
      "score":1000000,
      "opponent":100,
      "time_ms":0.015,
      "winner":true
    }
  ]
}
