{
  "X":{
    "player":"AI",
    "depth":5,
    "time_ms":7143.712
  },
  "O":{
    "player":"AI",
    "depth":5,
    "time_ms":5069.924
  },
  "board_size":15,
  "radius":2,
  "timeout":"none",
  "undo":true,
  "undo_limit":5,
  "winner":"X",
  "board_state":[
    ". . . . . . . . . . . . . . .",
    ". . . . . . . . . . . . . . .",
    ". . . . . . . . . . . . . . .",
    ". . . . . . . . . . . . . . .",
    ". . . . . . . . . . . . . . .",
    ". . . . . . . O X O . . . . .",
    ". . . . . . . O X X X X O . .",
    ". . . . . . O X O X X . . . .",
    ". . . . . X O O O O X X . . .",
    ". . . . . . X . . . O O X . .",
    ". . . . . . . . . . . . . . .",
    ". . . . . . . . . . . . . . .",
    ". . . . . . . . . . . . . . .",
    ". . . . . . . . . . . . . . .",
    ". . . . . . . . . . . . . . ."
  ],
  "moves":[
    {
      "X (AI)":"H7",
      "moves_evaluated":250,
      "time_ms":0.000
    },
    {
      "O (AI)":"J8",
      "moves_evaluated":1,
      "opponent":100,
      "time_ms":0.001
    },
    {
      "X (AI)":"J6",
      "moves_evaluated":160,
      "score":100,
      "time_ms":515.891
    },
    {
      "O (AI)":"K5",
      "moves_evaluated":2,
      "opponent":1500,
      "time_ms":0.024
    },
    {
      "X (AI)":"K7",
      "moves_evaluated":225,
      "score":100,
      "opponent":100,
      "time_ms":1188.303
    },
    {
      "O (AI)":"H5",
      "moves_evaluated":3,
      "opponent":1500,
      "time_ms":0.032
    },
    {
      "X (AI)":"J5",
      "moves_evaluated":1,
      "score":100,
      "opponent":1500,
      "time_ms":0.029
    },
    {
      "O (AI)":"G7",
      "moves_evaluated":47,
      "opponent":100,
      "time_ms":0.329
    },
    {
      "X (AI)":"K6",
      "moves_evaluated":255,
      "score":2000,
      "time_ms":1609.385
    },
    {
      "O (AI)":"G8",
      "moves_evaluated":250,
      "score":100,
      "opponent":500,
      "time_ms":2638.489
    },
    {
      "X (AI)":"G9",
      "moves_evaluated":1,
      "opponent":1500,
      "time_ms":0.033
    },
    {
      "O (AI)":"H8",
      "moves_evaluated":275,
      "score":3000,
      "opponent":2000,
      "time_ms":2430.333
    },
    {
      "X (AI)":"F8",
      "moves_evaluated":2,
      "score":100,
      "opponent":500000,
      "time_ms":0.014
    },
    {
      "O (AI)":"K8",
      "moves_evaluated":1,
      "score":100000,
      "opponent":500,
      "time_ms":0.021
    },
    {
      "X (AI)":"L8",
      "moves_evaluated":1,
      "score":500,
      "opponent":1000000,
      "time_ms":0.014
    },
    {
      "O (AI)":"M9",
      "moves_evaluated":1,
      "opponent":100000,
      "time_ms":0.015
    },
    {
      "X (AI)":"L6",
      "moves_evaluated":350,
      "score":1500,
      "opponent":100,
      "time_ms":3829.954
    },
    {
      "O (AI)":"H6",
      "moves_evaluated":3,
      "opponent":500000,
      "time_ms":0.018
    },
    {
      "X (AI)":"M6",
      "moves_evaluated":1,
      "score":100000,
      "time_ms":0.032
    },
    {
      "O (AI)":"N6",
      "moves_evaluated":2,
      "opponent":1000000,
      "time_ms":0.630
    },
    {
      "X (AI)":"L7",
      "moves_evaluated":1,
      "score":40000,
      "time_ms":0.026
    },
    {
      "O (AI)":"L9",
      "moves_evaluated":5,
      "score":2000,
      "opponent":500000,
      "time_ms":0.019
    },
    {
      "X (AI)":"M8",
      "moves_evaluated":2,
      "score":500000,
      "opponent":2000,
      "time_ms":0.016
    },
    {
      "O (AI)":"J7",
      "moves_evaluated":1,
      "score":500000,
      "opponent":100000,
      "time_ms":0.013
    },
    {
      "X (AI)":"N9",
      "moves_evaluated":2,
      "score":1000000,
      "opponent":1500,
      "time_ms":0.015,
      "winner":true
    }
  ]
}