{
  "X":{
    "player":"AI",
    "depth":5,
    "time_ms":3058.393
  },
  "O":{
    "player":"AI",
    "depth":5,
    "time_ms":6134.747
  },
  "board_size":15,
  "radius":2,
  "timeout":"none",
  "undo":true,
  "undo_limit":5,
  "winner":"O",
  "board_state":[
    ". . . . . . . . . . . . . . .",
    ". . . . . . . . . . . . . . .",
    ". . . . . . . . . . . . . . .",
    ". . . . . . . . . . . . . . .",
    ". . . . . . . . . . . . . . .",
    ". . . . . . . . . . . . . . .",
    ". . . . . . . . O X X . . . .",
    ". . . . O X X X X O . . . . .",
    ". . . . . . X . O O X . . . .",
    ". . . . . . O O X O . . . . .",
    ". . . . . . X . . O . . . . .",
    ". . . . . . . . . O . . . . .",
    ". . . . . . . . . . . . . . .",
    ". . . . . . . . . . . . . . .",
    ". . . . . . . . . . . . . . ."
  ],
  "moves":[
    {
      "X (AI)":"H7",
      "moves_evaluated":1,
      "time_ms":0.000
    },
    {
      "O (AI)":"J8",
      "moves_evaluated":1,
      "opponent":100,
      "time_ms":0.000
    },
    {
      "X (AI)":"G8",
      "moves_evaluated":160,
      "score":100,
      "time_ms":522.886
    },
    {
      "O (AI)":"J6",
      "moves_evaluated":2,
      "opponent":1500,
      "time_ms":0.021
    },
    {
      "X (AI)":"F7",
      "moves_evaluated":210,
      "score":100,
      "time_ms":1007.444
    },
    {
      "O (AI)":"H9",
      "moves_evaluated":235,
      "score":100,
      "opponent":1500,
      "time_ms":1434.772
    },
    {
      "X (AI)":"G7",
      "moves_evaluated":255,
      "score":3000,
      "time_ms":1527.962
    },
    {
      "O (AI)":"E7",
      "moves_evaluated":2,
      "opponent":500000,
      "time_ms":0.013
    },
    {
      "X (AI)":"J7",
      "moves_evaluated":1,
      "score":100000,
      "opponent":1500,
      "time_ms":0.022
    },
    {
      "O (AI)":"K7",
      "moves_evaluated":1,
      "score":3000,
      "opponent":1000000,
      "time_ms":0.013
    },
    {
      "X (AI)":"G10",
      "moves_evaluated":2,
      "opponent":500000,
      "time_ms":0.014
    },
    {
      "O (AI)":"G9",
      "moves_evaluated":1,
      "score":100,
      "opponent":500000,
      "time_ms":0.015
    },
    {
      "X (AI)":"L6",
      "moves_evaluated":1,
      "opponent":100000,
      "time_ms":0.014
    },
    {
      "O (AI)":"K8",
      "moves_evaluated":330,
      "score":2000,
      "opponent":100,
      "time_ms":3889.118
    },
    {
      "X (AI)":"L8",
      "moves_evaluated":1,
      "opponent":40000,
      "time_ms":0.016
    },
    {
      "O (AI)":"K9",
      "moves_evaluated":277,
      "score":1500,
      "opponent":100,
      "time_ms":810.766
    },
    {
      "X (AI)":"J9",
      "moves_evaluated":3,
      "opponent":500000,
      "time_ms":0.017
    },
    {
      "O (AI)":"K10",
      "moves_evaluated":2,
      "score":500000,
      "opponent":100,
      "time_ms":0.014
    },
    {
      "X (AI)":"K6",
      "moves_evaluated":2,
      "score":100,
      "opponent":1000000,
      "time_ms":0.018
    },
    {
      "O (AI)":"K11",
      "moves_evaluated":1,
      "score":1000000,
      "time_ms":0.015,
      "winner":true
    }
  ]
}