{
  "X":{
    "player":"AI",
    "depth":5,
    "time_ms":11358.479
  },
  "O":{
    "player":"AI",
    "depth":5,
    "time_ms":3475.795
  },
  "board_size":15,
  "radius":2,
  "timeout":"none",
  "undo":true,
  "undo_limit":5,
  "winner":"X",
  "board_state":[
    ". . . . . . . . . . . . . . .",
    ". . . . . . . . . . . . . . .",
    ". . . . . . . . . . . . . . .",
    ". . . . . . . . . . . . . . .",
    ". . . . . X . . X . . . . . .",
    ". . . . . . X O O . . . . . .",
    ". . . . . . O X O . . . . . .",
    ". . . . O O X X X X O . . . .",
    ". . . . O X X O O X . . . . .",
    ". . . X X O X X O . O . . . .",
    ". . . O . O X X . . . . . . .",
    ". . . . . . O . . . . . . . .",
    ". . . . . . . . . . . . . . .",
    ". . . . . . . . . . . . . . .",
    ". . . . . . . . . . . . . . ."
  ],
  "moves":[
    {
      "X (AI)":"H7",
      "moves_evaluated":1,
      "time_ms":0.000
    },
    {
      "O (AI)":"J8",
      "moves_evaluated":1,
      "opponent":100,
      "time_ms":0.000
    },
    {
      "X (AI)":"G8",
      "moves_evaluated":160,
      "score":100,
      "time_ms":523.161
    },
    {
      "O (AI)":"J6",
      "moves_evaluated":2,
      "opponent":1500,
      "time_ms":0.026
    },
    {
      "X (AI)":"H9",
      "moves_evaluated":210,
      "score":100,
      "opponent":100,
      "time_ms":1011.124
    },
    {
      "O (AI)":"F7",
      "moves_evaluated":3,
      "opponent":1500,
      "time_ms":0.032
    },
    {
      "X (AI)":"G9",
      "moves_evaluated":255,
      "score":2000,
      "time_ms":1497.802
    },
    {
      "O (AI)":"J9",
      "moves_evaluated":51,
      "score":100,
      "opponent":1500,
      "time_ms":0.479
    },
    {
      "X (AI)":"J7",
      "moves_evaluated":1,
      "score":100,
      "opponent":500000,
      "time_ms":0.011
    },
    {
      "O (AI)":"H8",
      "moves_evaluated":1,
      "score":100,
      "opponent":40000,
      "time_ms":0.012
    },
    {
      "X (AI)":"G7",
      "moves_evaluated":1,
      "score":30000,
      "opponent":1500,
      "time_ms":0.020
    },
    {
      "O (AI)":"G6",
      "moves_evaluated":3,
      "score":100,
      "opponent":500000,
      "time_ms":0.012
    },
    {
      "X (AI)":"K7",
      "moves_evaluated":1,
      "score":100000,
      "opponent":100,
      "time_ms":0.017
    },
    {
      "O (AI)":"L7",
      "moves_evaluated":2,
      "opponent":1000000,
      "time_ms":0.013
    },
    {
      "X (AI)":"G10",
      "moves_evaluated":1,
      "score":100000,
      "time_ms":0.018
    },
    {
      "O (AI)":"G11",
      "moves_evaluated":1,
      "opponent":1000000,
      "time_ms":0.012
    },
    {
      "X (AI)":"K8",
      "moves_evaluated":65,
      "score":2000,
      "opponent":30000,
      "time_ms":0.590
    },
    {
      "O (AI)":"H5",
      "moves_evaluated":325,
      "score":1500,
      "time_ms":3473.991
    },
    {
      "X (AI)":"J4",
      "moves_evaluated":2,
      "opponent":500000,
      "time_ms":0.016
    },
    {
      "O (AI)":"E8",
      "moves_evaluated":1,
      "score":100000,
      "time_ms":0.021
    },
    {
      "X (AI)":"D9",
      "moves_evaluated":1,
      "opponent":1000000,
      "time_ms":0.018
    },
    {
      "O (AI)":"F9",
      "moves_evaluated":1,
      "opponent":45000,
      "time_ms":0.018
    },
    {
      "X (AI)":"H10",
      "moves_evaluated":420,
      "score":2000,
      "opponent":500,
      "time_ms":8325.600
    },
    {
      "O (AI)":"F10",
      "moves_evaluated":84,
      "score":2000,
      "opponent":1500,
      "time_ms":1.097
    },
    {
      "X (AI)":"F8",
      "moves_evaluated":1,
      "score":3000,
      "opponent":500000,
      "time_ms":0.020
    },
    {
      "O (AI)":"E7",
      "moves_evaluated":3,
      "score":100,
      "opponent":500000,
      "time_ms":0.020
    },
    {
      "X (AI)":"E9",
      "moves_evaluated":1,
      "score":1500,
      "opponent":40000,
      "time_ms":0.019
    },
    {
      "O (AI)":"D10",
      "moves_evaluated":3,
      "opponent":500000,
      "time_ms":0.020
    },
    {
      "X (AI)":"H6",
      "moves_evaluated":1,
      "score":100000,
      "opponent":1500,
      "time_ms":0.030
    },
    {
      "O (AI)":"J5",
      "moves_evaluated":4,
      "score":100,
      "opponent":1000000,
      "time_ms":0.021
    },
    {
      "X (AI)":"G5",
      "moves_evaluated":2,
      "score":500000,
      "opponent":1500,
      "time_ms":0.016
    },
    {
      "O (AI)":"L9",
      "moves_evaluated":3,
      "opponent":1000000,
      "time_ms":0.021
    },
    {
      "X (AI)":"F4",
      "moves_evaluated":1,
      "score":1000000,
      "time_ms":0.017,
      "winner":true
    }
  ]
}