{
  "name": "block_open_four",
  "description": "O must block X's open four or lose immediately",
  "category": "defense",
  "difficulty": "trivial",
  "board_size": 15,
  "X": {"player": "human"},
  "O": {"player": "AI", "depth": 4},
  "moves": [
    {"X (human)": "H8"},
    {"O (AI)": "J9"},
    {"X (human)": "J8"},
    {"O (AI)": "K9"},
    {"X (human)": "K8"},
    {"O (AI)": "L9"},
    {"X (human)": "L8"}
  ],
  "expected_moves": [[7, 6], [7, 11]],
  "explanation": "X has open four at row 7: [7,7] [7,8] [7,9] [7,10]. O must play [7,6] or [7,11] to block."
}
