{
  "name": "create_double_three",
  "description": "X can create an unstoppable double-three threat",
  "category": "offense",
  "difficulty": "medium",
  "board_size": 15,
  "X": {"player": "AI", "depth": 4},
  "O": {"player": "human"},
  "moves": [
    {"X (AI)": "H7"},
    {"O (human)": "G6"},
    {"X (AI)": "J7"},
    {"O (human)": "J6"},
    {"X (AI)": "J8"},
    {"O (human)": "F5"},
    {"X (AI)": "K9"},
    {"O (human)": "E4"}
  ],
  "expected_moves": [[6, 7]],
  "explanation": "X plays [6,7] creating two open threes simultaneously: horizontal [6,7][7,7][7,8] and diagonal. O cannot block both."
}
