{
  "X":{
    "player":"AI",
    "depth":5,
    "time_ms":7209.649
  },
  "O":{
    "player":"AI",
    "depth":5,
    "time_ms":5143.098
  },
  "board_size":15,
  "radius":2,
  "timeout":"none",
  "undo":true,
  "undo_limit":5,
  "winner":"O",
  "board_state":[
    ". . . . . . . . . . . . . . .",
    ". . . . . . . . . . . . . . .",
    ". . . . . . . . . . . . . . .",
    ". . . . . . . . . . . . . . .",
    ". . . . . . . . . . . . . . .",
    ". . . . . . X O X O . . X . .",
    ". . . . . . O X X X X O . . .",
    ". . . . X . O X . X O . . . .",
    ". . . . . X O O O O X . . . .",
    ". . . . . . X . O . . O . . .",
    ". . . . . . . X . O . . . . .",
    ". . . . . . . . . . O . . . .",
    ". . . . . . . . . . . . . . .",
    ". . . . . . . . . . . . . . .",
    ". . . . . . . . . . . . . . ."
  ],
  "moves":[
    {
      "X (AI)":"H7",
      "moves_evaluated":3,
      "time_ms":0.000
    },
    {
      "O (AI)":"J8",
      "moves_evaluated":4,
      "opponent":100,
      "time_ms":0.001
    },
    {
      "X (AI)":"J6",
      "moves_evaluated":160,
      "score":100,
      "time_ms":535.139
    },
    {
      "O (AI)":"K5",
      "moves_evaluated":2,
      "opponent":1500,
      "time_ms":0.022
    },
    {
      "X (AI)":"K7",
      "moves_evaluated":225,
      "score":100,
      "opponent":100,
      "time_ms":1282.734
    },
    {
      "O (AI)":"H5",
      "moves_evaluated":3,
      "opponent":1500,
      "time_ms":0.027
    },
    {
      "X (AI)":"J5",
      "moves_evaluated":1,
      "score":100,
      "opponent":1500,
      "time_ms":0.028
    },
    {
      "O (AI)":"G7",
      "moves_evaluated":47,
      "opponent":100,
      "time_ms":0.335
    },
    {
      "X (AI)":"K6",
      "moves_evaluated":255,
      "score":2000,
      "time_ms":1575.518
    },
    {
      "O (AI)":"G8",
      "moves_evaluated":250,
      "score":100,
      "opponent":500,
      "time_ms":2638.096
    },
    {
      "X (AI)":"G9",
      "moves_evaluated":1,
      "opponent":1500,
      "time_ms":0.035
    },
    {
      "O (AI)":"H8",
      "moves_evaluated":275,
      "score":3000,
      "opponent":2000,
      "time_ms":2504.474
    },
    {
      "X (AI)":"F8",
      "moves_evaluated":2,
      "score":100,
      "opponent":500000,
      "time_ms":0.014
    },
    {
      "O (AI)":"K8",
      "moves_evaluated":1,
      "score":100000,
      "opponent":500,
      "time_ms":0.015
    },
    {
      "X (AI)":"L8",
      "moves_evaluated":1,
      "score":500,
      "opponent":1000000,
      "time_ms":0.015
    },
    {
      "O (AI)":"M9",
      "moves_evaluated":1,
      "opponent":100000,
      "time_ms":0.015
    },
    {
      "X (AI)":"L6",
      "moves_evaluated":350,
      "score":1500,
      "opponent":100,
      "time_ms":3816.069
    },
    {
      "O (AI)":"M6",
      "moves_evaluated":3,
      "opponent":500000,
      "time_ms":0.019
    },
    {
      "X (AI)":"H6",
      "moves_evaluated":1,
      "score":100000,
      "time_ms":0.024
    },
    {
      "O (AI)":"G6",
      "moves_evaluated":2,
      "score":500,
      "opponent":1000000,
      "time_ms":0.019
    },
    {
      "X (AI)":"G5",
      "moves_evaluated":1,
      "score":100,
      "opponent":100000,
      "time_ms":0.017
    },
    {
      "O (AI)":"L7",
      "moves_evaluated":1,
      "score":1500,
      "opponent":40000,
      "time_ms":0.015
    },
    {
      "X (AI)":"N5",
      "moves_evaluated":2,
      "opponent":500000,
      "time_ms":0.017
    },
    {
      "O (AI)":"J9",
      "moves_evaluated":1,
      "score":100000,
      "time_ms":0.028
    },
    {
      "X (AI)":"H10",
      "moves_evaluated":3,
      "score":1500,
      "opponent":1000000,
      "time_ms":0.021
    },
    {
      "O (AI)":"K10",
      "moves_evaluated":2,
      "score":500000,
      "time_ms":0.016
    },
    {
      "X (AI)":"E7",
      "moves_evaluated":2,
      "score":500000,
      "time_ms":0.018
    },
    {
      "O (AI)":"L11",
      "moves_evaluated":2,
      "score":1000000,
      "time_ms":0.016,
      "winner":true
    }
  ]
}